{
  "schema_version": "1.0",
  "audit_id": "ar-8534e104a0cce8fb",
  "run_id": "8534e104a0cce8fb",
  "classification": "VALID",
  "confidence": "medium",
  "evidence": [
    {
      "source": "validator",
      "observation": "Validator passed all 5 plausibility checks.",
      "weight": "strong"
    },
    {
      "source": "patcher",
      "observation": "Patcher applied 1 mutation(s) using strategy 'remove_null_guard'.",
      "weight": "moderate"
    }
  ],
  "reviewer": {
    "type": "deterministic",
    "name": "auditor_phase6_v1"
  },
  "audited_at": "2026-04-07T01:54:17Z"
}
