{
  "schema_version": "1.0",
  "audit_id": "ar-5fb65ac3a7052507",
  "run_id": "5fb65ac3a7052507",
  "classification": "VALID",
  "confidence": "medium",
  "evidence": [
    {
      "source": "validator",
      "observation": "Validator passed all 5 plausibility checks.",
      "weight": "strong"
    },
    {
      "source": "patcher",
      "observation": "Patcher applied 1 mutation(s) using strategy 'remove_free_call'.",
      "weight": "moderate"
    }
  ],
  "reviewer": {
    "type": "deterministic",
    "name": "auditor_phase6_v1"
  },
  "audited_at": "2026-04-07T02:14:02Z"
}
