{
  "schema_version": "1.0",
  "audit_id": "ar-a3f9c1e8b2d47065",
  "run_id": "a3f9c1e8b2d47065",
  "classification": "VALID",
  "confidence": "high",
  "evidence": [
    {
      "source": "validator",
      "observation": "All 3 checks passed: syntax, non_trivial, scope.",
      "weight": "strong",
      "detail": {
        "result_id": "vr-a3f9c1e8b2d47065",
        "overall": "PASS"
      }
    },
    {
      "source": "patcher",
      "observation": "Exactly 1 target applied. Bad/good diff is 5 characters at line 87 of src/parser/input_parser.c.",
      "weight": "strong",
      "detail": {
        "applied_count": 1,
        "skipped_count": 0
      }
    },
    {
      "source": "rule_engine",
      "observation": "Post-write access at line 92 is within the same function scope as the allocation at line 87. The undersized buffer will be overwritten before the function returns.",
      "weight": "strong",
      "detail": {
        "alloc_line": 87,
        "write_access_line": 92,
        "function_scope": "parse_input_buffer"
      }
    }
  ],
  "reviewer": {
    "type": "deterministic",
    "name": "rule_engine_v1"
  },
  "audited_at": "2026-04-06T10:15:04Z",
  "notes": ""
}
