{
  "schema_version": "1.0",
  "audit_id": "ar-ec50a5df4806aca9",
  "run_id": "ec50a5df4806aca9",
  "classification": "VALID",
  "confidence": "medium",
  "evidence": [
    {
      "source": "validator",
      "observation": "Validator passed all 5 plausibility checks.",
      "weight": "strong"
    },
    {
      "source": "patcher",
      "observation": "Patcher applied 1 mutation(s) using strategy 'alloc_size_undercount'.",
      "weight": "moderate"
    }
  ],
  "reviewer": {
    "type": "deterministic",
    "name": "auditor_phase6_v1"
  },
  "audited_at": "2026-04-07T02:14:01Z"
}
